{
  "protocol_version": "act/1.0",
  "event_type": "genesis",
  "occurred_at": "2026-07-16T00:00:00Z",
  "actor": {
    "actor_id": "018f5b1a-0000-7000-8000-000000000010",
    "key_id": "ed25519:aaaaaaaaaaaaaaaa"
  },
  "tenant": "act-protocol",
  "subject": {
    "kind": "artifact",
    "artifact_id": "018f5b1a-0000-7000-8000-000000000011",
    "artifact_type": "Intent"
  },
  "causal_parents": [],
  "content_descriptors": [],
  "policy_context": { "not_applicable": true, "reason": "genesis event predates any policy" },
  "payload": { "note": "root intent for the ACT protocol repository" },
  "extensions": {}
}
